<?xml version="1.0" encoding="UTF-8"?>

<!DOCTYPE project_record SYSTEM "project_record.dtd">

<project_record>
    
    <title>Project Record</title>
    
    <metadata>
        <key_name>Trabalho 3</key_name>
        <project_title>Criar uma Stylesheet XSLT para gerar um Website.</project_title>
        <begin_date>28/10/2020</begin_date>
        <end_date>4/11/2020</end_date>
        <supervisors>
            <supervisor href="http://www.di.uminho.pt/~jcr">Prof. José Carlos Ramalho</supervisor>
        </supervisors>
    </metadata>
    
    <workteam>
        <member>
            <num_aluno id="PG42816"></num_aluno>
            <nome>Cândido Vale</nome>
            <email>pg42816@alunos.uminho.pt</email>
            <ref url="https://github.com/cvale21"></ref>
        </member>
    </workteam>
    
    <abstract>
        <parag> 
            Este trabalho é referente ao <bold>TPC3</bold>, onde o <underlined>objetivo é criar uma stylesheet <italic>XSLT</italic> 
                que permita gerar um Website para o dataset dos <bold>Arqueossítios do NW Português</bold>. </underlined>
        </parag>
        
        <parag>Link para o respositório: 
            <bold><link url="https://github.com/cvale21/DAW2020"></link></bold>
        </parag>
        
    </abstract>
    
    <deliverables>
        <deliverable url="arq.xsl"></deliverable>
        <deliverable url="arq.dtd"></deliverable>
        <deliverable url="project_record.dtd"></deliverable>
        <deliverable url="project_record.xml"></deliverable>
    </deliverables>
    
    <date>4/11/202</date>
    
</project_record>
